{
  "schema_version": "1.0",
  "process_map_id": "PROCESS-MAP-NORTHSTAR-MULTI-DOMAIN-001",
  "customer_name": "Northstar Shared Services Cooperative - Synthetic",
  "profile_source_sha256": "c951f3f322663c2b6dcef2a58b94b69a5744b8cd55a031163b10c5e2a89ce24f",
  "confirmation_status": "analyst_confirmed",
  "confirmed_by": "Synthetic Account Planning Analyst",
  "confirmed_on": "2026-07-21",
  "prioritization": {
    "method": "Rank each analyst-mapped process by strategy alignment, observed workload, existing automation foundation, process coherence, delivery risk, and evidence quality.",
    "criteria": [
      "strategy_alignment",
      "workload_signal",
      "automation_foundation",
      "process_coherence",
      "delivery_risk",
      "evidence_quality"
    ],
    "decisions": [
      {
        "process_id": "PROC-INVOICE-EXCEPTION",
        "status": "selected",
        "rank": 2,
        "strategy_alignment": "confirmed",
        "rationale": "Selected second because invoice linkage, ownership, and foundation are confirmed; access governance is stronger.",
        "observed_evidence": [
          "Two active Finance records span live invoice intake and UAT exception triage.",
          "The source separately lists 18,000 annual submissions and 4,200 annual exceptions.",
          "The customer workshop confirms invoice_id across the frozen exports, the Finance Operations Lead as disposition owner, and 100 completed exceptions available after data approval."
        ],
        "validation_needed": [
          "Finance data-owner approval for the historical sample",
          "Product, licensing, connectivity, and deployment compatibility",
          "Observed baselines and owner-approved go, revise, and stop tolerances"
        ]
      },
      {
        "process_id": "PROC-ACCESS-ASSURANCE",
        "status": "selected",
        "rank": 1,
        "strategy_alignment": "confirmed",
        "rationale": "Selected first because confirmed linkage, ownership, foundation, and CIO priority provide strongest evidence.",
        "observed_evidence": [
          "Two active assurance records span deployed evidence extraction and UAT exception narrative work.",
          "The source lists 26,400 entitlement lines and 1,200 exceptions annually.",
          "The CIO workshop confirms campaign_id and entitlement_id across the frozen exports, the Access Governance Manager as outcome owner, and 120 completed exceptions available after access approval."
        ],
        "validation_needed": [
          "Identity-data access approval for the historical sample",
          "Product, licensing, connectivity, and deployment compatibility",
          "Observed baselines and owner-approved go, revise, and stop tolerances"
        ]
      },
      {
        "process_id": "PROC-VENDOR-ONBOARDING",
        "status": "selected",
        "rank": 3,
        "strategy_alignment": "confirmed",
        "rationale": "Selected third because supplier linkage, ownership, and foundation are confirmed; sensitive data adds risk.",
        "observed_evidence": [
          "Two active Procurement records cover production supplier intake and approved-backlog risk review.",
          "The source separately lists 1,400 intake requests and 900 risk reviews annually.",
          "The customer workshop confirms supplier_request_id across the frozen exports, the Supplier Risk Lead as taxonomy and outcome owner, and 80 redacted files available after data approval."
        ],
        "validation_needed": [
          "Supplier-data access and redaction approval for the historical sample",
          "Product, licensing, connectivity, and deployment compatibility",
          "Observed baselines and owner-approved go, revise, and stop tolerances"
        ]
      },
      {
        "process_id": "PROC-EMPLOYEE-LIFECYCLE",
        "status": "deferred",
        "rank": 4,
        "strategy_alignment": "confirmed",
        "rationale": "Defer because sparse ownership and mixed request types reduce process coherence until HR establishes one boundary, baseline, and accountable pilot owner.",
        "observed_evidence": [
          "The mapped HR records include one deployed onboarding check and one idea-stage benefits intake.",
          "The two mapped HR records list 3,850 annual requests."
        ],
        "validation_needed": [
          "A decision on whether onboarding and benefits requests share one process boundary",
          "A named benefits-intake owner and destination system"
        ]
      },
      {
        "process_id": "PROC-VENDOR-MASTER",
        "status": "deferred",
        "rank": 5,
        "strategy_alignment": "not_identified",
        "rationale": "Defer because the source marks master creation paused until Procurement names an owner, restart trigger, and replacement-system boundary.",
        "observed_evidence": [
          "One Procurement Operations record describes vendor master creation with a paused lifecycle status."
        ],
        "validation_needed": [
          "A named process owner and restart decision after the ERP migration",
          "The replacement system boundary and authorized write path"
        ]
      }
    ]
  },
  "processes": [
    {
      "process_id": "PROC-INVOICE-EXCEPTION",
      "name": "Supplier invoice exception resolution",
      "business_function": "Finance operations",
      "boundary": {
        "starts_when": "invoice enters the Finance mailbox",
        "ends_when": "Finance records disposition and payment-review handoff",
        "business_outcome": "complete evidence supports review; posting and payment excluded"
      },
      "inventory_ids": [
        "INV-INVENTORY-R00002",
        "INV-INVENTORY-R00003"
      ],
      "membership_rationale": "The two active records cover invoice intake and match-exception review within one invoice-resolution boundary.",
      "linkage": {
        "status": "confirmed",
        "rationale": "The inventory omits the join column, but the customer workshop confirms invoice_id across the frozen intake and exception exports.",
        "validation_step": "An analyst verifies twenty joined records and documents every unmatched case before the workshop."
      }
    },
    {
      "process_id": "PROC-VENDOR-ONBOARDING",
      "name": "Vendor onboarding evidence readiness",
      "business_function": "Procurement operations",
      "boundary": {
        "starts_when": "supplier request enters portal",
        "ends_when": "Supplier Risk Lead records the review outcome",
        "business_outcome": "traceable risk decision supports onboarding; vendor-master creation excluded"
      },
      "inventory_ids": [
        "INV-INVENTORY-R00005",
        "INV-INVENTORY-R00006"
      ],
      "membership_rationale": "The two active records represent supplier intake and evidence review within one onboarding-readiness decision path.",
      "linkage": {
        "status": "confirmed",
        "rationale": "The inventory omits the join column, but the customer workshop confirms supplier_request_id across the frozen intake and risk-review exports.",
        "validation_step": "An analyst verifies twenty joined supplier records and documents every unmatched case before the workshop."
      }
    },
    {
      "process_id": "PROC-VENDOR-MASTER",
      "name": "Vendor master creation",
      "business_function": "Procurement operations",
      "boundary": {
        "starts_when": "an approved supplier result is ready for master-data processing",
        "ends_when": "an authorized owner creates the supplier record in the replacement system",
        "business_outcome": "approved suppliers receive a controlled and auditable master record"
      },
      "inventory_ids": [
        "INV-INVENTORY-R00007"
      ],
      "membership_rationale": "The single paused record describes the distinct vendor master creation step after onboarding review.",
      "linkage": {
        "status": "not_applicable",
        "rationale": "Only one inventory record belongs to this paused process boundary.",
        "validation_step": "Procurement names the owner, restart trigger, replacement system, and authorized write path before reconsideration."
      }
    },
    {
      "process_id": "PROC-ACCESS-ASSURANCE",
      "name": "Quarterly privileged access assurance",
      "business_function": "IT assurance",
      "boundary": {
        "starts_when": "quarterly access campaign opens",
        "ends_when": "Access Governance Manager records the certification decision",
        "business_outcome": "traceable evidence closes certification; access changes excluded"
      },
      "inventory_ids": [
        "INV-INVENTORY-R00008",
        "INV-INVENTORY-R00009"
      ],
      "membership_rationale": "The two active records cover evidence extraction and exception preparation for the same quarterly access-assurance decision cycle.",
      "linkage": {
        "status": "confirmed",
        "rationale": "The inventory omits the join columns, but the CIO workshop confirms campaign_id and entitlement_id across the frozen evidence and exception exports.",
        "validation_step": "An analyst verifies thirty joined exception records and documents every unmatched case before the workshop."
      }
    },
    {
      "process_id": "PROC-EMPLOYEE-LIFECYCLE",
      "name": "Employee lifecycle requests",
      "business_function": "Human resources operations",
      "boundary": {
        "starts_when": "HR receives an onboarding packet or benefits life-event request",
        "ends_when": "HR records completeness and routes the request to its human decision owner",
        "business_outcome": "complete employee-service submissions reach the correct HR reviewer with traceable context"
      },
      "inventory_ids": [
        "INV-INVENTORY-R00011",
        "INV-INVENTORY-R00012"
      ],